{
  "$schema": "https://json-schema.org/draft/2020-12/schema",
  "$id": "https://kitsunekode.dev/sweep/schemas/scan-plan.schema.json",
  "title": "ScanPlan",
  "type": "object",
  "additionalProperties": false,
  "required": [
    "protocolVersion",
    "targetDir",
    "selectionPolicy",
    "candidates",
    "summary",
    "selectedCandidateIds",
    "createdAt"
  ],
  "properties": {
    "protocolVersion": {
      "const": "1"
    },
    "targetDir": {
      "type": "string"
    },
    "selectionPolicy": {
      "$ref": "#/$defs/selectionPolicy"
    },
    "candidates": {
      "type": "array",
      "items": {
        "$ref": "#/$defs/scanCandidate"
      }
    },
    "summary": {
      "type": "object",
      "additionalProperties": false,
      "required": [
        "candidateCount",
        "estimatedTotalBytes",
        "scannedDirs",
        "exact",
        "selectedCount",
        "riskCounts"
      ],
      "properties": {
        "candidateCount": {
          "type": "integer",
          "minimum": 0,
          "maximum": 9007199254740991
        },
        "estimatedTotalBytes": {
          "type": "integer",
          "minimum": 0,
          "maximum": 9007199254740991
        },
        "scannedDirs": {
          "type": "integer",
          "minimum": 0,
          "maximum": 9007199254740991
        },
        "exact": {
          "type": "boolean"
        },
        "selectedCount": {
          "type": "integer",
          "minimum": 0,
          "maximum": 9007199254740991
        },
        "riskCounts": {
          "type": "object",
          "additionalProperties": false,
          "required": ["safe", "caution", "dangerous", "blocked"],
          "properties": {
            "safe": {
              "type": "integer",
              "minimum": 0,
              "maximum": 9007199254740991
            },
            "caution": {
              "type": "integer",
              "minimum": 0,
              "maximum": 9007199254740991
            },
            "dangerous": {
              "type": "integer",
              "minimum": 0,
              "maximum": 9007199254740991
            },
            "blocked": {
              "type": "integer",
              "minimum": 0,
              "maximum": 9007199254740991
            }
          }
        },
        "skippedDirs": {
          "type": "integer",
          "minimum": 0,
          "maximum": 9007199254740991
        }
      }
    },
    "selectedCandidateIds": {
      "type": "array",
      "items": {
        "type": "string"
      }
    },
    "createdAt": {
      "type": "string",
      "format": "date-time"
    },
    "targetIdentity": {
      "$ref": "#/$defs/filesystemIdentity"
    }
  },
  "$defs": {
    "selectionPolicy": {
      "type": "object",
      "additionalProperties": false,
      "required": ["mode", "includeDangerous"],
      "properties": {
        "mode": {
          "type": "string",
          "enum": ["default", "safe", "all", "none"]
        },
        "includeDangerous": {
          "type": "boolean"
        }
      }
    },
    "scanCandidate": {
      "type": "object",
      "additionalProperties": false,
      "required": [
        "id",
        "path",
        "name",
        "estimatedBytes",
        "isSymlink",
        "entryType",
        "kind",
        "riskTier",
        "reasons",
        "selectedByDefault"
      ],
      "properties": {
        "id": {
          "type": "string"
        },
        "path": {
          "type": "string"
        },
        "name": {
          "type": "string"
        },
        "estimatedBytes": {
          "type": "integer",
          "minimum": 0,
          "maximum": 9007199254740991
        },
        "bytesKnown": {
          "type": "boolean"
        },
        "modifiedMs": {
          "type": "integer",
          "minimum": 0,
          "maximum": 9007199254740991
        },
        "isSymlink": {
          "type": "boolean"
        },
        "entryType": {
          "type": "string",
          "enum": ["file", "directory", "symlink"]
        },
        "kind": {
          "type": "string",
          "enum": [
            "node_modules",
            "dist",
            "build",
            "out",
            ".next",
            ".nuxt",
            ".svelte-kit",
            ".turbo",
            ".vite",
            ".parcel-cache",
            "target",
            "coverage",
            ".nyc_output",
            "tsbuildinfo",
            "custom"
          ]
        },
        "riskTier": {
          "type": "string",
          "enum": ["safe", "caution", "dangerous", "blocked"]
        },
        "reasons": {
          "type": "array",
          "maxItems": 64,
          "items": {
            "type": "string",
            "maxLength": 1024
          }
        },
        "selectedByDefault": {
          "type": "boolean"
        },
        "identity": {
          "$ref": "#/$defs/filesystemIdentity"
        }
      }
    },
    "filesystemIdentity": {
      "type": "object",
      "additionalProperties": false,
      "required": ["platform", "device", "inode"],
      "properties": {
        "platform": {
          "type": "string",
          "enum": ["unix", "windows"]
        },
        "device": {
          "type": "string",
          "pattern": "^(0|[1-9][0-9]{0,19})$"
        },
        "inode": {
          "type": "string",
          "pattern": "^[1-9][0-9]{0,19}$"
        }
      }
    }
  }
}
