{
  "protocolVersion": "1",
  "targetDir": "__FIXTURE_ROOT__",
  "selectionPolicy": {
    "mode": "default",
    "includeDangerous": false
  },
  "candidates": [
    {
      "path": "__FIXTURE_ROOT__/apps/docs/.next",
      "name": ".next",
      "estimatedBytes": 0,
      "bytesKnown": true,
      "isSymlink": false,
      "entryType": "directory",
      "id": "cand_a7288b1b2a18dedd",
      "kind": ".next",
      "riskTier": "safe",
      "reasons": ["default-pattern"],
      "selectedByDefault": true
    },
    {
      "path": "__FIXTURE_ROOT__/apps/docs/tsconfig.tsbuildinfo",
      "name": "tsconfig.tsbuildinfo",
      "estimatedBytes": 0,
      "bytesKnown": true,
      "isSymlink": false,
      "entryType": "file",
      "id": "cand_5c43c55e52cd337d",
      "kind": "tsbuildinfo",
      "riskTier": "safe",
      "reasons": ["default-pattern"],
      "selectedByDefault": true
    },
    {
      "path": "__FIXTURE_ROOT__/packages/api/target",
      "name": "target",
      "estimatedBytes": 0,
      "bytesKnown": true,
      "isSymlink": false,
      "entryType": "directory",
      "id": "cand_5426091b52c830a3",
      "kind": "target",
      "riskTier": "safe",
      "reasons": ["default-pattern"],
      "selectedByDefault": true
    },
    {
      "path": "__FIXTURE_ROOT__/packages/web/node_modules",
      "name": "node_modules",
      "estimatedBytes": 0,
      "bytesKnown": true,
      "isSymlink": false,
      "entryType": "directory",
      "id": "cand_2a2d8f17594bd811",
      "kind": "node_modules",
      "riskTier": "safe",
      "reasons": ["default-pattern"],
      "selectedByDefault": true
    }
  ],
  "summary": {
    "candidateCount": 4,
    "estimatedTotalBytes": 0,
    "scannedDirs": 7,
    "exact": false,
    "selectedCount": 4,
    "riskCounts": {
      "safe": 4,
      "caution": 0,
      "dangerous": 0,
      "blocked": 0
    }
  },
  "selectedCandidateIds": [
    "cand_a7288b1b2a18dedd",
    "cand_5c43c55e52cd337d",
    "cand_5426091b52c830a3",
    "cand_2a2d8f17594bd811"
  ],
  "createdAt": "1970-01-01T00:00:00.000Z"
}
