{
  "protocolVersion": "1",
  "targetDir": "__FIXTURE_ROOT__",
  "selectionPolicy": {
    "mode": "default",
    "includeDangerous": false
  },
  "candidates": [
    {
      "path": "__FIXTURE_ROOT__/app/node_modules",
      "name": "node_modules",
      "estimatedBytes": 0,
      "bytesKnown": true,
      "isSymlink": false,
      "entryType": "directory",
      "id": "cand_0a945782c15c8f86",
      "kind": "node_modules",
      "riskTier": "safe",
      "reasons": ["default-pattern"],
      "selectedByDefault": true
    },
    {
      "path": "__FIXTURE_ROOT__/crate/target",
      "name": "target",
      "estimatedBytes": 0,
      "bytesKnown": true,
      "isSymlink": false,
      "entryType": "directory",
      "id": "cand_a14f8aa801ec6fca",
      "kind": "target",
      "riskTier": "safe",
      "reasons": ["default-pattern"],
      "selectedByDefault": true
    },
    {
      "path": "__FIXTURE_ROOT__/docs/target",
      "name": "target",
      "estimatedBytes": 0,
      "bytesKnown": true,
      "isSymlink": false,
      "entryType": "file",
      "id": "cand_538bdcdb0a5959c2",
      "kind": "target",
      "riskTier": "dangerous",
      "reasons": ["default-pattern", "entry-type-mismatch"],
      "selectedByDefault": false
    },
    {
      "path": "__FIXTURE_ROOT__/notes/target",
      "name": "target",
      "estimatedBytes": 0,
      "bytesKnown": true,
      "isSymlink": false,
      "entryType": "directory",
      "id": "cand_a394cb03f16d4c23",
      "kind": "target",
      "riskTier": "dangerous",
      "reasons": ["default-pattern", "no-project-marker"],
      "selectedByDefault": false
    },
    {
      "path": "__FIXTURE_ROOT__/pkg/odd.tsbuildinfo",
      "name": "odd.tsbuildinfo",
      "estimatedBytes": 0,
      "bytesKnown": true,
      "isSymlink": false,
      "entryType": "directory",
      "id": "cand_5bd4ca689c6a08c9",
      "kind": "tsbuildinfo",
      "riskTier": "dangerous",
      "reasons": ["default-pattern", "entry-type-mismatch"],
      "selectedByDefault": false
    },
    {
      "path": "__FIXTURE_ROOT__/pkg/tsconfig.tsbuildinfo",
      "name": "tsconfig.tsbuildinfo",
      "estimatedBytes": 0,
      "bytesKnown": true,
      "isSymlink": false,
      "entryType": "file",
      "id": "cand_8db3bdeac3650542",
      "kind": "tsbuildinfo",
      "riskTier": "safe",
      "reasons": ["default-pattern"],
      "selectedByDefault": true
    },
    {
      "path": "__FIXTURE_ROOT__/tagged/target",
      "name": "target",
      "estimatedBytes": 0,
      "bytesKnown": true,
      "isSymlink": false,
      "entryType": "directory",
      "id": "cand_72166e342c5d56e0",
      "kind": "target",
      "riskTier": "safe",
      "reasons": ["default-pattern"],
      "selectedByDefault": true
    }
  ],
  "summary": {
    "candidateCount": 7,
    "estimatedTotalBytes": 0,
    "scannedDirs": 7,
    "exact": false,
    "selectedCount": 4,
    "riskCounts": {
      "safe": 4,
      "caution": 0,
      "dangerous": 3,
      "blocked": 0
    }
  },
  "selectedCandidateIds": [
    "cand_0a945782c15c8f86",
    "cand_a14f8aa801ec6fca",
    "cand_8db3bdeac3650542",
    "cand_72166e342c5d56e0"
  ],
  "createdAt": "1970-01-01T00:00:00.000Z"
}
