{
  "protocolVersion": "1",
  "targetDir": "__FIXTURE_ROOT__",
  "selectionPolicy": {
    "mode": "default",
    "includeDangerous": false
  },
  "candidates": [
    {
      "path": "__FIXTURE_ROOT__/build",
      "name": "build",
      "estimatedBytes": 0,
      "isSymlink": false,
      "entryType": "directory",
      "id": "cand_621f8b69e4fcb0e6",
      "kind": "build",
      "riskTier": "dangerous",
      "reasons": ["opt-in-pattern"],
      "selectedByDefault": false
    },
    {
      "path": "__FIXTURE_ROOT__/dist",
      "name": "dist",
      "estimatedBytes": 0,
      "isSymlink": false,
      "entryType": "directory",
      "id": "cand_2486f23ba12f32b3",
      "kind": "dist",
      "riskTier": "dangerous",
      "reasons": ["opt-in-pattern"],
      "selectedByDefault": false
    },
    {
      "path": "__FIXTURE_ROOT__/node_modules",
      "name": "node_modules",
      "estimatedBytes": 0,
      "isSymlink": false,
      "entryType": "directory",
      "id": "cand_83aa32d09099fa4d",
      "kind": "node_modules",
      "riskTier": "safe",
      "reasons": ["default-pattern"],
      "selectedByDefault": true
    },
    {
      "path": "__FIXTURE_ROOT__/pkg.egg-info",
      "name": "pkg.egg-info",
      "estimatedBytes": 0,
      "isSymlink": false,
      "entryType": "directory",
      "id": "cand_da0d847cc3bed8b3",
      "kind": "custom",
      "riskTier": "dangerous",
      "reasons": ["opt-in-pattern"],
      "selectedByDefault": false
    }
  ],
  "summary": {
    "candidateCount": 4,
    "estimatedTotalBytes": 0,
    "scannedDirs": 2,
    "exact": false,
    "selectedCount": 1,
    "riskCounts": {
      "safe": 1,
      "caution": 0,
      "dangerous": 3,
      "blocked": 0
    }
  },
  "selectedCandidateIds": ["cand_83aa32d09099fa4d"],
  "createdAt": "1970-01-01T00:00:00.000Z"
}
