{
  "protocolVersion": "1",
  "targetDir": "__FIXTURE_ROOT__",
  "selectionPolicy": {
    "mode": "default",
    "includeDangerous": false
  },
  "candidates": [
    {
      "path": "__FIXTURE_ROOT__/node_modules",
      "name": "node_modules",
      "estimatedBytes": 0,
      "isSymlink": false,
      "entryType": "directory",
      "id": "cand_83aa32d09099fa4d",
      "kind": "node_modules",
      "riskTier": "safe",
      "reasons": ["default-pattern"],
      "selectedByDefault": true
    },
    {
      "path": "__FIXTURE_ROOT__/tsconfig.tsbuildinfo",
      "name": "tsconfig.tsbuildinfo",
      "estimatedBytes": 0,
      "isSymlink": false,
      "entryType": "file",
      "id": "cand_0b3e7843e19ed89a",
      "kind": "tsbuildinfo",
      "riskTier": "safe",
      "reasons": ["default-pattern"],
      "selectedByDefault": true
    }
  ],
  "summary": {
    "candidateCount": 2,
    "estimatedTotalBytes": 0,
    "scannedDirs": 2,
    "exact": false,
    "selectedCount": 2,
    "riskCounts": {
      "safe": 2,
      "caution": 0,
      "dangerous": 0,
      "blocked": 0
    }
  },
  "selectedCandidateIds": ["cand_83aa32d09099fa4d", "cand_0b3e7843e19ed89a"],
  "createdAt": "1970-01-01T00:00:00.000Z"
}
