{
  "protocolVersion": "1",
  "targetDir": "__FIXTURE_ROOT__",
  "selectionPolicy": {
    "mode": "default",
    "includeDangerous": false
  },
  "candidates": [
    {
      "path": "__FIXTURE_ROOT__/node_modules",
      "name": "node_modules",
      "estimatedBytes": 0,
      "isSymlink": false,
      "entryType": "directory",
      "id": "cand_83aa32d09099fa4d",
      "kind": "node_modules",
      "riskTier": "safe",
      "reasons": ["default-pattern"],
      "selectedByDefault": true
    },
    {
      "path": "__FIXTURE_ROOT__/target",
      "name": "target",
      "estimatedBytes": 0,
      "isSymlink": true,
      "entryType": "symlink",
      "id": "cand_2d9120daa67af747",
      "kind": "target",
      "riskTier": "caution",
      "reasons": ["symlink", "default-pattern"],
      "selectedByDefault": false
    }
  ],
  "summary": {
    "candidateCount": 2,
    "estimatedTotalBytes": 0,
    "scannedDirs": 3,
    "exact": false,
    "selectedCount": 1,
    "riskCounts": {
      "safe": 1,
      "caution": 1,
      "dangerous": 0,
      "blocked": 0
    }
  },
  "selectedCandidateIds": ["cand_83aa32d09099fa4d"],
  "createdAt": "1970-01-01T00:00:00.000Z"
}
