{
  "protocolVersion": "1",
  "targetDir": "__FIXTURE_ROOT__",
  "selectionPolicy": {
    "mode": "default",
    "includeDangerous": false
  },
  "candidates": [
    {
      "path": "__FIXTURE_ROOT__/apps/docs/.next",
      "name": ".next",
      "estimatedBytes": 0,
      "bytesKnown": true,
      "isSymlink": false,
      "entryType": "directory",
      "id": "cand_a7288b1b2a18dedd",
      "kind": ".next",
      "riskTier": "safe",
      "reasons": ["default-pattern"],
      "selectedByDefault": true
    },
    {
      "path": "__FIXTURE_ROOT__/packages/web/node_modules",
      "name": "node_modules",
      "estimatedBytes": 0,
      "bytesKnown": true,
      "isSymlink": false,
      "entryType": "directory",
      "id": "cand_2a2d8f17594bd811",
      "kind": "node_modules",
      "riskTier": "safe",
      "reasons": ["default-pattern"],
      "selectedByDefault": true
    }
  ],
  "summary": {
    "candidateCount": 2,
    "estimatedTotalBytes": 0,
    "scannedDirs": 7,
    "exact": false,
    "selectedCount": 2,
    "riskCounts": {
      "safe": 2,
      "caution": 0,
      "dangerous": 0,
      "blocked": 0
    }
  },
  "selectedCandidateIds": ["cand_a7288b1b2a18dedd", "cand_2a2d8f17594bd811"],
  "createdAt": "1970-01-01T00:00:00.000Z"
}
